{
  "id": "agent-harness-engineering",
  "title": "Agent 驾驭工程之美",
  "focus_question": "如何用 Harness 重构自己的学习循环，并让进度可恢复、可检验、可应用？",
  "sources": [
    {
      "path": "content/Knowledge/Sources/Agent 驾驭工程之美",
      "unit_strategy": "file"
    }
  ],
  "units": [
    {
      "id": "lesson-00",
      "title": "00｜驾驭⼯程：Agent 时代必修课-Agent 驾驭工程之美-极客时间",
      "source_path": "content/Knowledge/Sources/Agent 驾驭工程之美/00｜驾驭⼯程：Agent 时代必修课-Agent 驾驭工程之美-极客时间.md",
      "locator": null
    },
    {
      "id": "lesson-01",
      "title": "01｜操控循环：驾驭工程的核心框架-Agent 驾驭工程之美-极客时间",
      "source_path": "content/Knowledge/Sources/Agent 驾驭工程之美/01｜操控循环：驾驭工程的核心框架-Agent 驾驭工程之美-极客时间.md",
      "locator": null
    },
    {
      "id": "lesson-02",
      "title": "02｜四个子系统：构成框架与内置 Harness 拆解-Agent 驾驭工程之美-极客时间",
      "source_path": "content/Knowledge/Sources/Agent 驾驭工程之美/02｜四个子系统：构成框架与内置 Harness 拆解-Agent 驾驭工程之美-极客时间.md",
      "locator": null
    },
    {
      "id": "lesson-03",
      "title": "03｜一个例子：从零搭建背单词 Harness-Agent 驾驭工程之美-极客时间",
      "source_path": "content/Knowledge/Sources/Agent 驾驭工程之美/03｜一个例子：从零搭建背单词 Harness-Agent 驾驭工程之美-极客时间.md",
      "locator": null
    },
    {
      "id": "lesson-04",
      "title": "04｜封装技能：把操控循环装进 SKILL-Agent 驾驭工程之美-极客时间",
      "source_path": "content/Knowledge/Sources/Agent 驾驭工程之美/04｜封装技能：把操控循环装进 SKILL-Agent 驾驭工程之美-极客时间.md",
      "locator": null
    },
    {
      "id": "lesson-05",
      "title": "05｜驾驭工程的六个最佳实践-Agent 驾驭工程之美-极客时间",
      "source_path": "content/Knowledge/Sources/Agent 驾驭工程之美/05｜驾驭工程的六个最佳实践-Agent 驾驭工程之美-极客时间.md",
      "locator": null
    },
    {
      "id": "lesson-06",
      "title": "06｜知识固化：从头构造一个 Harness-Agent 驾驭工程之美-极客时间",
      "source_path": "content/Knowledge/Sources/Agent 驾驭工程之美/06｜知识固化：从头构造一个 Harness-Agent 驾驭工程之美-极客时间.md",
      "locator": null
    },
    {
      "id": "lesson-07",
      "title": "07｜需求模糊：Agent 不知道“好”长什么样-Agent 驾驭工程之美-极客时间",
      "source_path": "content/Knowledge/Sources/Agent 驾驭工程之美/07｜需求模糊：Agent 不知道“好”长什么样-Agent 驾驭工程之美-极客时间.md",
      "locator": null
    },
    {
      "id": "lesson-08",
      "title": "08｜隐式约定：规则只存在于人的脑子里-Agent 驾驭工程之美-极客时间",
      "source_path": "content/Knowledge/Sources/Agent 驾驭工程之美/08｜隐式约定：规则只存在于人的脑子里-Agent 驾驭工程之美-极客时间.md",
      "locator": null
    },
    {
      "id": "lesson-09",
      "title": "09｜信息散落：知识来源不唯一且更新不及时-Agent 驾驭工程之美-极客时间",
      "source_path": "content/Knowledge/Sources/Agent 驾驭工程之美/09｜信息散落：知识来源不唯一且更新不及时-Agent 驾驭工程之美-极客时间.md",
      "locator": null
    },
    {
      "id": "lesson-10",
      "title": "10｜虚假胜利：Agent 以为自己做完了，其实没有-Agent 驾驭工程之美-极客时间",
      "source_path": "content/Knowledge/Sources/Agent 驾驭工程之美/10｜虚假胜利：Agent 以为自己做完了，其实没有-Agent 驾驭工程之美-极客时间.md",
      "locator": null
    },
    {
      "id": "lesson-11",
      "title": "11｜指令文件腐化：AGENTS.md 越来越长，Agent 反而变笨了-Agent 驾驭工程之美-极客时间",
      "source_path": "content/Knowledge/Sources/Agent 驾驭工程之美/11｜指令文件腐化：AGENTS.md 越来越长，Agent 反而变笨了-Agent 驾驭工程之美-极客时间.md",
      "locator": null
    },
    {
      "id": "lesson-12",
      "title": "12｜前馈痴迷：Agent 做完就交，从来没人检查-Agent 驾驭工程之美-极客时间",
      "source_path": "content/Knowledge/Sources/Agent 驾驭工程之美/12｜前馈痴迷：Agent 做完就交，从来没人检查-Agent 驾驭工程之美-极客时间.md",
      "locator": null
    },
    {
      "id": "lesson-13",
      "title": "13｜反馈过载：Sensors 太多，Agent 不知道哪个信号重要？-Agent 驾驭工程之美-极客时间",
      "source_path": "content/Knowledge/Sources/Agent 驾驭工程之美/13｜反馈过载：Sensors 太多，Agent 不知道哪个信号重要？-Agent 驾驭工程之美-极客时间.md",
      "locator": null
    },
    {
      "id": "lesson-14",
      "title": "14｜上下文倾倒：信息过多，Agent 反而迷失-Agent 驾驭工程之美-极客时间",
      "source_path": "content/Knowledge/Sources/Agent 驾驭工程之美/14｜上下文倾倒：信息过多，Agent 反而迷失-Agent 驾驭工程之美-极客时间.md",
      "locator": null
    },
    {
      "id": "lesson-15",
      "title": "15｜上下文焦虑：Agent 在长对话中丢失关键信息-Agent 驾驭工程之美-极客时间",
      "source_path": "content/Knowledge/Sources/Agent 驾驭工程之美/15｜上下文焦虑：Agent 在长对话中丢失关键信息-Agent 驾驭工程之美-极客时间.md",
      "locator": null
    }
  ],
  "completion_policy": {
    "unit": {
      "required": [
        "coverage"
      ]
    },
    "claim": {
      "required": [
        "distillation_decision"
      ]
    },
    "project": {
      "required": [
        "source_grounding",
        "retrieval",
        "application"
      ]
    }
  },
  "constraints": [
    "不把阅读覆盖自动视为理解或掌握",
    "Human First Expression 必须来自用户自己的复述、问题或命题"
  ],
  "created_at": "2026-08-28T01:42:09Z",
  "updated_at": "2026-09-22T12:05:47Z"
}
